{
  "schemaVersion": "responseos.promotion-policy.v1",
  "policyVersion": "1.0.0",
  "sourceEnvironment": "staging",
  "targetEnvironment": "production",
  "rules": [
    { "id": "schema-version", "label": "Environment schema version", "path": "/schemaVersion", "classification": "MUST_MATCH", "category": "audit", "required": true, "rationale": "Promotion compares one contract generation only." },
    { "id": "contract-version", "label": "Environment contract version", "path": "/contractVersion", "classification": "MUST_MATCH", "category": "audit", "required": true, "rationale": "Production must implement the certified v1 contract." },
    { "id": "environment-name", "label": "Environment name", "path": "/identity/name", "classification": "MUST_DIFFER", "category": "resource", "required": true, "rationale": "Production must not identify as staging." },
    { "id": "environment-class", "label": "Environment class", "path": "/identity/environmentClass", "classification": "MUST_DIFFER", "category": "resource", "required": true, "rationale": "Production must use the Production class after provisioning." },
    { "id": "environment-lifecycle", "label": "Governed lifecycle", "path": "/identity/lifecycle", "classification": "MUST_MATCH", "category": "control", "required": true, "rationale": "A certifiable Production environment must be governed, not ad hoc." },
    { "id": "application-framework", "label": "Application framework", "path": "/identity/application/framework", "classification": "MUST_MATCH", "category": "runtime", "required": true, "rationale": "Promotion preserves the application runtime architecture." },
    { "id": "application-node", "label": "Application Node major", "path": "/identity/application/nodeVersion", "classification": "MUST_MATCH", "category": "runtime", "required": true, "rationale": "Runtime major must match certified staging." },
    { "id": "application-package-manager", "label": "Package manager contract", "path": "/identity/application/packageManager", "classification": "MUST_MATCH", "category": "runtime", "required": true, "rationale": "Reproducible dependency installation must match." },
    { "id": "schema-lineage", "label": "Database schema lineage", "path": "/identity/application/schemaLineage", "classification": "MUST_MATCH", "category": "database", "required": true, "rationale": "Production migrations must come from the same repository lineage." },

    { "id": "vercel-team", "label": "Vercel team identity", "path": "/vercel/teamId", "classification": "MUST_MATCH", "category": "resource", "required": true, "rationale": "The approved AJ Digital Vercel ownership boundary is preserved." },
    { "id": "vercel-project-id", "label": "Vercel project ID", "path": "/vercel/projectId", "classification": "MUST_DIFFER", "category": "resource", "required": true, "rationale": "Production must use an independent Vercel project." },
    { "id": "vercel-project-name", "label": "Vercel project name", "path": "/vercel/projectName", "classification": "MUST_DIFFER", "category": "resource", "required": true, "rationale": "Production project naming must not reuse the staging target." },
    { "id": "vercel-node", "label": "Vercel Node major", "path": "/vercel/nodeVersion", "classification": "MUST_MATCH", "category": "runtime", "required": true, "rationale": "Build/runtime Node posture must match." },
    { "id": "vercel-environment-id", "label": "Vercel custom environment ID", "path": "/vercel/customEnvironment/id", "classification": "MUST_DIFFER", "category": "resource", "required": true, "rationale": "Production cannot reuse the governed staging environment." },
    { "id": "vercel-environment-slug", "label": "Vercel custom environment slug", "path": "/vercel/customEnvironment/slug", "classification": "MUST_DIFFER", "category": "resource", "required": true, "rationale": "The target must be explicitly Production-scoped." },
    { "id": "vercel-environment-type", "label": "Vercel environment type", "path": "/vercel/customEnvironment/type", "classification": "MUST_DIFFER", "category": "resource", "required": true, "rationale": "The Production target cannot remain a preview-class environment." },
    { "id": "deployment-mode", "label": "Manual deployment mode", "path": "/vercel/deploymentMode", "classification": "MUST_MATCH", "category": "control", "required": true, "rationale": "Production deployment remains explicitly dispatched." },
    { "id": "automatic-git-deploy", "label": "Automatic Git deployment disabled", "path": "/vercel/automaticGitDeployments", "classification": "MUST_MATCH", "category": "control", "required": true, "rationale": "Automatic Git deployment stays disabled until governance supersedes v1." },
    { "id": "manual-only", "label": "Manual-only deployment requirement", "path": "/vercel/manualOnly", "classification": "MUST_MATCH", "category": "control", "required": true, "rationale": "Promotion and deploy remain separate approvals." },
    { "id": "deployment-protection", "label": "Deployment Protection requirement", "path": "/vercel/deploymentProtection", "classification": "MUST_MATCH", "category": "control", "required": true, "rationale": "Protected readback and smoke remain required." },
    { "id": "alias-policy", "label": "Production alias policy", "path": "/vercel/aliasPolicy", "classification": "HUMAN_APPROVAL_REQUIRED", "category": "approval", "required": true, "rationale": "No Production alias is activated without human approval." },
    { "id": "domain-policy", "label": "Production domain policy", "path": "/vercel/domainPolicy", "classification": "HUMAN_APPROVAL_REQUIRED", "category": "approval", "required": true, "rationale": "No Production domain is activated without human approval." },

    { "id": "database-provider", "label": "Database provider architecture", "path": "/database/provider", "classification": "MUST_MATCH", "category": "database", "required": true, "rationale": "The certified Standard-lane Postgres architecture is preserved." },
    { "id": "database-project-id", "label": "Neon project ID", "path": "/database/projectId", "classification": "MUST_DIFFER", "category": "resource", "required": true, "rationale": "Production must have an independent Neon project." },
    { "id": "database-project-name", "label": "Neon project name", "path": "/database/projectName", "classification": "MUST_DIFFER", "category": "resource", "required": true, "rationale": "Production resource naming must not reuse staging." },
    { "id": "database-branch-id", "label": "Neon branch ID", "path": "/database/branchId", "classification": "MUST_DIFFER", "category": "resource", "required": true, "rationale": "Production branch identity must be independent." },
    { "id": "database-branch-name", "label": "Neon primary branch naming", "path": "/database/branchName", "classification": "MUST_MATCH", "category": "database", "required": true, "rationale": "The main-branch semantic is preserved inside the independent project." },
    { "id": "database-endpoint-id", "label": "Neon endpoint ID", "path": "/database/endpointId", "classification": "MUST_DIFFER", "category": "resource", "required": true, "rationale": "Production runtime cannot share the staging endpoint." },
    { "id": "database-name", "label": "Database logical name", "path": "/database/databaseName", "classification": "MUST_MATCH", "category": "database", "required": true, "rationale": "The logical database contract is preserved within independent resources." },
    { "id": "runtime-db-mode", "label": "Pooled runtime connection mode", "path": "/database/runtimeConnectionMode", "classification": "MUST_MATCH", "category": "database", "required": true, "rationale": "Runtime connections remain pooled." },
    { "id": "migration-db-mode", "label": "Direct migration connection mode", "path": "/database/migrationConnectionMode", "classification": "MUST_MATCH", "category": "database", "required": true, "rationale": "Migrations remain on the direct endpoint." },
    { "id": "pooled-direct-separation", "label": "Pooled/direct separation", "path": "/database/pooledDirectSeparationRequired", "classification": "MUST_MATCH", "category": "database", "required": true, "rationale": "Runtime and migration credentials remain separate." },
    { "id": "migration-policy", "label": "Migration-before-application policy", "path": "/database/migrationPolicy", "classification": "MUST_MATCH", "category": "database", "required": true, "rationale": "Production deploy preserves the fail-closed migration sequence." },

    { "id": "auth-provider", "label": "Authentication provider", "path": "/authentication/provider", "classification": "MUST_MATCH", "category": "authentication", "required": true, "rationale": "The Standard-lane auth architecture is preserved." },
    { "id": "auth-required", "label": "Authentication-required semantics", "path": "/authentication/authRequired", "classification": "MUST_MATCH", "category": "authentication", "required": true, "rationale": "Hosted Production must fail closed." },
    { "id": "auth-provider-class", "label": "Clerk provider class", "path": "/authentication/providerClass", "classification": "MUST_DIFFER", "category": "authentication", "required": true, "rationale": "Production must use a Clerk Production instance, not development." },
    { "id": "auth-credential-class", "label": "Clerk credential class", "path": "/authentication/credentialClass", "classification": "MUST_DIFFER", "category": "authentication", "required": true, "rationale": "Production cannot use test credentials." },
    { "id": "auth-required-vars", "label": "Required authentication variable names", "path": "/authentication/requiredVariables", "classification": "MUST_MATCH", "category": "authentication", "required": true, "rationale": "Required binding semantics remain identical even though values differ." },